{"$schema":"https://json-schema.org/draft/2020-12/schema","title":"Audit R2 admission attestation","type":"object","additionalProperties":false,"required":["schemaVersion","status","stageId","correctionId","stageInstanceDigest","programAmendmentDigest","ownerAuthorityBindingDigest","successorVerifierCodeDigest","successorVerifierContractDigest","exactDependencySetDigest","exactStructuredCommandsDigest","exactWriteSetDigest","exactAcceptanceSignalsDigest","predecessorReleaseEventDigest","leaseAcquisitionEventDigest","fenceEventDigest","fencingCounter","decision"],"properties":{"schemaVersion":{"const":"AUDIT_R2_STAGE_ADMISSION_ATTESTATION_V1"},"status":{"const":"ADMITTED"},"stageId":{"const":"AUDIT_R2_FINAL_CORRECTION"},"correctionId":{"const":"YALKEN_R24_AUDIT_ROUND_2_FINAL_CORRECTIONS_V1"},"stageInstanceDigest":{"type":"string","pattern":"^[a-f0-9]{64}$"},"programAmendmentDigest":{"type":"string","pattern":"^[a-f0-9]{64}$"},"ownerAuthorityBindingDigest":{"type":"string","pattern":"^[a-f0-9]{64}$"},"successorVerifierCodeDigest":{"type":"string","pattern":"^[a-f0-9]{64}$"},"successorVerifierContractDigest":{"type":"string","pattern":"^[a-f0-9]{64}$"},"exactDependencySetDigest":{"type":"string","pattern":"^[a-f0-9]{64}$"},"exactStructuredCommandsDigest":{"type":"string","pattern":"^[a-f0-9]{64}$"},"exactWriteSetDigest":{"type":"string","pattern":"^[a-f0-9]{64}$"},"exactAcceptanceSignalsDigest":{"type":"string","pattern":"^[a-f0-9]{64}$"},"predecessorReleaseEventDigest":{"type":"string","pattern":"^[a-f0-9]{64}$"},"leaseAcquisitionEventDigest":{"type":"string","pattern":"^[a-f0-9]{64}$"},"fenceEventDigest":{"type":"string","pattern":"^[a-f0-9]{64}$"},"fencingCounter":{"const":54},"decision":{"const":"DIRECT_OWNER_AUTHORITY_BOUND_APPEND_ONLY_SUCCESSOR_ADMITTED"}}}
