{"correctionId":"YALKEN_R24_AUDIT_ROUND_2_FINAL_CORRECTIONS_V1","decision":"DIRECT_OWNER_AUTHORITY_BOUND_APPEND_ONLY_SUCCESSOR_ADMITTED","exactAcceptanceSignalsDigest":"b0e00bb9b39d2efb1f08ad0b7eda67765b8ce258b713a7379ebba6d683f14edd","exactDependencySetDigest":"49ccfc6133c2438e9040d082b63b6a9e5ac85465e57236b1f40411b3e190b7d5","exactStructuredCommandsDigest":"b991ab28a973001ba625f544862aa98d75d1390e4c810b1dc7b5c3594c936f53","exactWriteSetDigest":"4e7e399e7a06d983151081d6826da40850f58489c037ff1b4a7ef8c8b8a3e201","fenceEventDigest":"67981fab4ceece81a12af7a7e49deab099c809cac26ecbd84cad2f28ae1e0cc0","fencingCounter":54,"leaseAcquisitionEventDigest":"db4296d38b5e7693a093e1a8828d61c296e0fea23ed77c184d5ffcf3ef104ea9","ownerAuthorityBindingDigest":"be68bd97021d13fbfb75c73791bda7f6bfeebecebf525d4a927d1a4c9fe9efd6","predecessorReleaseEventDigest":"dd254938553936209f92c5cb9f6856769f36a999e1e3e3caab58c33792642dc4","programAmendmentDigest":"cb55bc1f802972105aa442fff7166861fce096d0fba2e7a367e585319804cbb0","schemaVersion":"AUDIT_R2_STAGE_ADMISSION_ATTESTATION_V1","stageId":"AUDIT_R2_FINAL_CORRECTION","stageInstanceDigest":"1f23244ded10ee22045046fb3d2e4767b2d22efe746e461634b61db021f7a5d6","status":"ADMITTED","successorVerifierCodeDigest":"f6ff040d1b02b4db7195f57a4fc6527003f3903c3a66703924df0905fe095807","successorVerifierContractDigest":"093615deb41bd2b33f7c31508e1cf1022149e00a7d79fa49a104672b2ecafae8"}
